{
  "id": "activisions",
  "title": "Activisions",
  "metadata_status": "stub",
  "publishers": [
    {
      "name": "Activision"
    }
  ],
  "country": "US",
  "language": "en",
  "first_issue": {
    "date": "1981"
  },
  "last_issue": {
    "date": "1984"
  },
  "status": "ceased",
  "categories": {
    "type": "newsletter",
    "platforms": [
      "atari-2600"
    ]
  },
  "numbering": {
    "scheme": "sequential",
    "notes": "unverified"
  },
  "default_provider": "vghf",
  "rights": {
    "status": "link-only",
    "note": "Inherited from default provider; review before hosting."
  },
  "known_sources": [
    {
      "provider": "vghf",
      "url": "https://archive.gamehistory.org/folder/fdb5a523-54e5-40a3-aab4-efc9dc0faee7",
      "date_range": "Fall 1981 – est. early 1984",
      "items": 10
    },
    {
      "provider": "internet-archive",
      "url": "https://archive.org/details/activisions",
      "items": 9,
      "date_range": "1981–1983"
    }
  ],
  "stats": {
    "issues": 10,
    "pages": 53,
    "readable": 0,
    "with_text": 9,
    "first_year": 1981,
    "last_year": 1984
  },
  "updated_at": "2026-09-15T08:21:17+00:00"
}
