{
  "id": "mean-machines",
  "title": "Mean Machines",
  "metadata_status": "stub",
  "publishers": [
    {
      "name": "EMAP"
    }
  ],
  "country": "GB",
  "language": "en",
  "first_issue": {
    "date": "1990-10"
  },
  "last_issue": {
    "date": "1992-09"
  },
  "status": "ceased",
  "categories": {
    "type": "consumer",
    "platforms": [
      "multi"
    ]
  },
  "numbering": {
    "scheme": "sequential",
    "notes": "unverified"
  },
  "default_provider": "internet-archive",
  "rights": {
    "status": "community-scan",
    "note": "Inherited from default provider; review before hosting."
  },
  "known_sources": [],
  "stats": {
    "issues": 0,
    "pages": 0,
    "readable": 0,
    "with_text": 0
  },
  "updated_at": "2026-09-17T10:21:14+00:00",
  "description": "Split into Mean Machines Sega and Nintendo Magazine System."
}
