{
  "id": "sinclair-user",
  "title": "Sinclair User",
  "short": "SU",
  "metadata_status": "stub",
  "publishers": [
    {
      "name": "ECC Publications"
    },
    {
      "name": "EMAP"
    }
  ],
  "country": "GB",
  "language": "en",
  "first_issue": {
    "date": "1982-04"
  },
  "last_issue": {
    "date": "1993-04"
  },
  "status": "ceased",
  "categories": {
    "type": "consumer",
    "platforms": [
      "zx-spectrum"
    ]
  },
  "numbering": {
    "scheme": "sequential",
    "notes": "unverified"
  },
  "default_provider": "internet-archive",
  "rights": {
    "status": "community-scan",
    "note": "Inherited from default provider; review before hosting."
  },
  "known_sources": [],
  "stats": {
    "issues": 0,
    "pages": 0,
    "readable": 0,
    "with_text": 0
  },
  "updated_at": "2026-09-15T18:03:24+00:00"
}
