{
  "id": "electronic-gaming-retail-news",
  "title": "Electronic Gaming Retail News",
  "metadata_status": "stub",
  "publishers": [],
  "country": "US",
  "language": "en",
  "first_issue": {
    "date": "1991-07-01"
  },
  "last_issue": {
    "date": "1993-06"
  },
  "status": "ceased",
  "categories": {
    "type": "consumer",
    "platforms": [
      "multi"
    ]
  },
  "numbering": {
    "scheme": "sequential",
    "notes": "unverified"
  },
  "default_provider": "vghf",
  "rights": {
    "status": "link-only",
    "note": "Inherited from default provider; review before hosting."
  },
  "known_sources": [
    {
      "provider": "vghf",
      "url": "https://archive.gamehistory.org/folder/3e35f3c1-7416-4d78-b295-009a65f13276",
      "date_range": "July 1, 1991 – June 1993",
      "items": 11
    }
  ],
  "stats": {
    "issues": 11,
    "pages": 416,
    "readable": 0,
    "with_text": 11,
    "first_year": 1991,
    "last_year": 1993
  },
  "updated_at": "2026-09-17T09:34:50+00:00"
}
