{
  "id": "electronic-gaming-monthly",
  "title": "Electronic Gaming Monthly",
  "short": "EGM",
  "metadata_status": "stub",
  "publishers": [
    {
      "name": "Sendai Publishing"
    },
    {
      "name": "Ziff Davis"
    },
    {
      "name": "EGM Media"
    }
  ],
  "country": "US",
  "language": "en",
  "first_issue": {
    "date": "1989"
  },
  "last_issue": {
    "date": "2009-01"
  },
  "status": "ceased",
  "categories": {
    "type": "consumer",
    "platforms": [
      "multi"
    ]
  },
  "numbering": {
    "scheme": "sequential",
    "notes": "unverified"
  },
  "default_provider": "internet-archive",
  "rights": {
    "status": "community-scan",
    "note": "Inherited from default provider; review before hosting."
  },
  "known_sources": [
    {
      "provider": "internet-archive",
      "url": "https://archive.org/details/electronic-gaming-monthly",
      "items": 419,
      "date_range": "1992–2026"
    },
    {
      "provider": "vghf",
      "url": "https://archive.gamehistory.org/folder/89024108-47f9-4718-a679-83a8710716d9",
      "items": 347,
      "date_range": "May/June 1989 – Winter 2013–2014"
    }
  ],
  "stats": {
    "issues": 347,
    "pages": 46895,
    "readable": 347,
    "with_text": 323,
    "first_year": 1988,
    "last_year": 2015
  },
  "updated_at": "2026-09-16T09:25:20+00:00",
  "description": "Revived briefly 2009-2014."
}
