{
  "id": "game-specific-promotional-magazines-assorted",
  "title": "Game-specific promotional magazines, assorted",
  "metadata_status": "stub",
  "publishers": [],
  "country": "US",
  "language": "en",
  "first_issue": {
    "date": "2005"
  },
  "last_issue": {
    "date": "2005"
  },
  "status": "ceased",
  "categories": {
    "type": "consumer",
    "platforms": [
      "multi"
    ]
  },
  "numbering": {
    "scheme": "sequential",
    "notes": "unverified"
  },
  "default_provider": "vghf",
  "rights": {
    "status": "link-only",
    "note": "Inherited from default provider; review before hosting."
  },
  "known_sources": [
    {
      "provider": "vghf",
      "url": "https://archive.gamehistory.org/folder/680c3edb-68a7-4316-aa7a-c32891b9e2d2",
      "date_range": "2005 – 2005",
      "items": 1
    }
  ],
  "stats": {
    "issues": 1,
    "pages": 28,
    "readable": 1,
    "with_text": 1,
    "first_year": 2005,
    "last_year": 2005
  },
  "updated_at": "2026-09-17T13:18:36+00:00"
}
