{
  "id": "digital-diner",
  "title": "Digital Diner",
  "metadata_status": "stub",
  "publishers": [],
  "country": "US",
  "language": "en",
  "first_issue": {
    "date": "1996"
  },
  "last_issue": {
    "date": "1997-07"
  },
  "status": "ceased",
  "categories": {
    "type": "consumer",
    "platforms": [
      "pc"
    ]
  },
  "numbering": {
    "scheme": "sequential",
    "notes": "unverified"
  },
  "default_provider": "vghf",
  "rights": {
    "status": "link-only",
    "note": "Inherited from default provider; review before hosting."
  },
  "known_sources": [
    {
      "provider": "vghf",
      "url": "https://archive.gamehistory.org/folder/94ef167c-978b-464a-93ac-2e0047f8172f",
      "date_range": "est. late 1996 – July 1997",
      "items": 2
    }
  ],
  "stats": {
    "issues": 2,
    "pages": 268,
    "readable": 0,
    "with_text": 2,
    "first_year": 1996,
    "last_year": 1997
  },
  "updated_at": "2026-09-14T18:59:56+00:00"
}
