{
  "id": "incite",
  "title": "Incite Video Gaming / Incite PC Gaming",
  "metadata_status": "stub",
  "publishers": [
    {
      "name": "Ziff Davis"
    }
  ],
  "country": "US",
  "language": "en",
  "first_issue": {
    "date": "1999-07"
  },
  "last_issue": {
    "date": "2000-08"
  },
  "status": "ceased",
  "categories": {
    "type": "consumer",
    "platforms": [
      "multi",
      "pc"
    ]
  },
  "numbering": {
    "scheme": "sequential",
    "notes": "unverified"
  },
  "default_provider": "vghf",
  "rights": {
    "status": "link-only",
    "note": "Inherited from default provider; review before hosting."
  },
  "known_sources": [
    {
      "provider": "vghf",
      "url": "https://archive.gamehistory.org/folder/56f6db10-774b-4a5c-83ec-832180d3b0b9",
      "date_range": "December 1999 – July 1999 – August 2000",
      "items": 18
    }
  ],
  "stats": {
    "issues": 18,
    "pages": 2732,
    "readable": 18,
    "with_text": 18,
    "first_year": 1999,
    "last_year": 2000
  },
  "updated_at": "2026-09-17T06:56:38+00:00"
}
