{
  "id": "tips-and-tricks",
  "title": "Tips & Tricks",
  "metadata_status": "stub",
  "publishers": [
    {
      "name": "LFP Inc."
    }
  ],
  "country": "US",
  "language": "en",
  "first_issue": {
    "date": "1994"
  },
  "last_issue": {
    "date": "2011-02"
  },
  "status": "ceased",
  "categories": {
    "type": "consumer",
    "platforms": [
      "multi"
    ]
  },
  "numbering": {
    "scheme": "sequential",
    "notes": "unverified"
  },
  "default_provider": "vghf",
  "rights": {
    "status": "link-only",
    "note": "Inherited from default provider; review before hosting."
  },
  "known_sources": [
    {
      "provider": "vghf",
      "url": "https://archive.gamehistory.org/folder/eea584fc-380a-44ca-a485-d4dcc87114db",
      "date_range": "Spring 1994 – 1998 – February 2011",
      "items": 187
    }
  ],
  "stats": {
    "issues": 187,
    "pages": 18550,
    "readable": 187,
    "with_text": 182,
    "first_year": 1994,
    "last_year": 2010
  },
  "updated_at": "2026-09-17T13:18:36+00:00"
}
