{
  "id": "game-players",
  "title": "Game Players",
  "metadata_status": "stub",
  "publishers": [
    {
      "name": "Signal Research"
    },
    {
      "name": "GP Publications"
    },
    {
      "name": "Imagine Media"
    }
  ],
  "country": "US",
  "language": "en",
  "first_issue": {
    "date": "1989"
  },
  "last_issue": {
    "date": "1998"
  },
  "status": "ceased",
  "categories": {
    "type": "consumer",
    "platforms": [
      "multi"
    ]
  },
  "numbering": {
    "scheme": "sequential",
    "notes": "unverified"
  },
  "default_provider": "internet-archive",
  "rights": {
    "status": "community-scan",
    "note": "Inherited from default provider; review before hosting."
  },
  "known_sources": [
    {
      "provider": "vghf",
      "url": "https://archive.gamehistory.org/folder/b3155081-1b6e-42a2-85de-ec742f7c29f5",
      "items": 238,
      "date_range": "July 1998 – October 1996 – June 1998"
    }
  ],
  "stats": {
    "issues": 238,
    "pages": 27281,
    "readable": 238,
    "with_text": 235,
    "first_year": 1988,
    "last_year": 1998
  },
  "updated_at": "2026-09-17T13:18:36+00:00",
  "description": "Later Ultra Game Players."
}
