{
  "id": "official-uk-playstation-magazine",
  "title": "Official UK PlayStation Magazine",
  "short": "OPM UK",
  "metadata_status": "stub",
  "publishers": [
    {
      "name": "Future Publishing"
    }
  ],
  "country": "GB",
  "language": "en",
  "first_issue": {
    "date": "1995-11"
  },
  "last_issue": {
    "date": "2004-03"
  },
  "status": "ceased",
  "categories": {
    "type": "official",
    "platforms": [
      "playstation"
    ]
  },
  "numbering": {
    "scheme": "sequential",
    "notes": "unverified"
  },
  "default_provider": "internet-archive",
  "rights": {
    "status": "community-scan",
    "note": "Inherited from default provider; review before hosting."
  },
  "known_sources": [],
  "stats": {
    "issues": 0,
    "pages": 0,
    "readable": 0,
    "with_text": 0
  },
  "updated_at": "2026-09-15T21:03:50+00:00"
}
