{
  "id": "electronic-fun-with-computers-and-games",
  "title": "Electronic Fun with Computers & Games",
  "metadata_status": "stub",
  "publishers": [],
  "country": "US",
  "language": "en",
  "first_issue": {
    "date": "1982-11"
  },
  "last_issue": {
    "date": "1984-05"
  },
  "status": "ceased",
  "categories": {
    "type": "consumer",
    "platforms": [
      "multi"
    ]
  },
  "numbering": {
    "scheme": "sequential",
    "notes": "unverified"
  },
  "default_provider": "vghf",
  "rights": {
    "status": "link-only",
    "note": "Inherited from default provider; review before hosting."
  },
  "known_sources": [
    {
      "provider": "vghf",
      "url": "https://archive.gamehistory.org/folder/3efe8939-db36-49fb-a73b-1cca104dee71",
      "date_range": "November 1982 – May 1984",
      "items": 19
    }
  ],
  "stats": {
    "issues": 19,
    "pages": 1864,
    "readable": 0,
    "with_text": 19,
    "first_year": 1982,
    "last_year": 1984
  },
  "updated_at": "2026-09-17T09:34:50+00:00"
}
