{
  "id": "official-us-playstation-magazine",
  "title": "Official U.S. PlayStation Magazine",
  "short": "OPM",
  "metadata_status": "stub",
  "publishers": [
    {
      "name": "Ziff Davis"
    }
  ],
  "country": "US",
  "language": "en",
  "first_issue": {
    "date": "1997-10"
  },
  "last_issue": {
    "date": "2007-01"
  },
  "status": "ceased",
  "categories": {
    "type": "official",
    "platforms": [
      "playstation"
    ]
  },
  "numbering": {
    "scheme": "sequential",
    "notes": "unverified"
  },
  "default_provider": "vghf",
  "rights": {
    "status": "link-only",
    "note": "Inherited from default provider; review before hosting."
  },
  "known_sources": [
    {
      "provider": "vghf",
      "url": "https://archive.gamehistory.org/folder/b434cdd1-e02e-4bd4-833e-6cc0884403ef",
      "date_range": "October 1997 – est. summer 1998",
      "items": 113
    }
  ],
  "stats": {
    "issues": 113,
    "pages": 15850,
    "readable": 0,
    "with_text": 111,
    "first_year": 1997,
    "last_year": 2007
  },
  "updated_at": "2026-09-14T22:32:25+00:00"
}
