{
  "id": "videogames-computer-entertainment",
  "title": "VideoGames & Computer Entertainment / VideoGames: The Ultimate Gaming Magazine",
  "short": "VG&CE",
  "metadata_status": "stub",
  "publishers": [
    {
      "name": "LFP Inc."
    }
  ],
  "country": "US",
  "language": "en",
  "first_issue": {
    "date": "1988-12"
  },
  "last_issue": {
    "date": "1996-09"
  },
  "status": "ceased",
  "categories": {
    "type": "consumer",
    "platforms": [
      "multi"
    ]
  },
  "numbering": {
    "scheme": "sequential",
    "notes": "unverified"
  },
  "default_provider": "vghf",
  "rights": {
    "status": "link-only",
    "note": "Inherited from default provider; review before hosting."
  },
  "known_sources": [
    {
      "provider": "vghf",
      "url": "https://archive.gamehistory.org/folder/677805d5-f5ca-440c-bb28-475df519602f",
      "date_range": "December 1988 – September 1996"
    }
  ],
  "stats": {
    "issues": 0,
    "pages": 0,
    "readable": 0,
    "with_text": 0
  },
  "updated_at": "2026-09-05T21:21:32+00:00"
}
