{
  "id": "nintendo-magazine-system",
  "title": "Nintendo Magazine System / Official Nintendo Magazine",
  "short": "NMS",
  "metadata_status": "stub",
  "publishers": [
    {
      "name": "EMAP"
    },
    {
      "name": "Future Publishing"
    }
  ],
  "country": "GB",
  "language": "en",
  "first_issue": {
    "date": "1992-10"
  },
  "last_issue": {
    "date": "2014-10"
  },
  "status": "ceased",
  "categories": {
    "type": "official",
    "platforms": [
      "nintendo"
    ]
  },
  "numbering": {
    "scheme": "sequential",
    "notes": "unverified"
  },
  "default_provider": "internet-archive",
  "rights": {
    "status": "community-scan",
    "note": "Inherited from default provider; review before hosting."
  },
  "known_sources": [],
  "stats": {
    "issues": 0,
    "pages": 0,
    "readable": 0,
    "with_text": 0
  },
  "updated_at": "2026-09-15T18:03:24+00:00"
}
