{
  "id": "diehard-gamefan",
  "title": "DieHard GameFan",
  "short": "GameFan",
  "metadata_status": "stub",
  "publishers": [
    {
      "name": "DieHard Gamers Club"
    },
    {
      "name": "Shinno Media"
    }
  ],
  "country": "US",
  "language": "en",
  "first_issue": {
    "date": "1992-09"
  },
  "last_issue": {
    "date": "2000-12"
  },
  "status": "ceased",
  "categories": {
    "type": "consumer",
    "platforms": [
      "multi"
    ]
  },
  "numbering": {
    "scheme": "sequential",
    "notes": "unverified"
  },
  "default_provider": "internet-archive",
  "rights": {
    "status": "community-scan",
    "note": "Inherited from default provider; review before hosting."
  },
  "known_sources": [
    {
      "provider": "vghf",
      "url": "https://archive.gamehistory.org/folder/e3d7153a-504c-4383-a173-acace3680a6d",
      "items": 21,
      "date_range": "October 1992 – December 2000"
    }
  ],
  "stats": {
    "issues": 21,
    "pages": 2622,
    "readable": 0,
    "with_text": 19,
    "first_year": 1992,
    "last_year": 2000
  },
  "updated_at": "2026-09-16T09:25:20+00:00"
}
