{
  "id": "e3-show-daily",
  "title": "E3 Show Daily",
  "metadata_status": "stub",
  "publishers": [],
  "country": "US",
  "language": "en",
  "first_issue": {
    "date": "1995"
  },
  "last_issue": {
    "date": "2016"
  },
  "status": "ceased",
  "categories": {
    "type": "trade",
    "platforms": [
      "multi"
    ]
  },
  "numbering": {
    "scheme": "sequential",
    "notes": "unverified"
  },
  "default_provider": "vghf",
  "rights": {
    "status": "link-only",
    "note": "Inherited from default provider; review before hosting."
  },
  "known_sources": [
    {
      "provider": "vghf",
      "url": "https://archive.gamehistory.org/folder/ae5ac294-dcfd-45b8-86de-465d80e8dd8d",
      "date_range": "May 11, 1995 – June 16, 2016",
      "items": 29
    }
  ],
  "stats": {
    "issues": 29,
    "pages": 1909,
    "readable": 0,
    "with_text": 28,
    "first_year": 1995,
    "last_year": 2016
  },
  "updated_at": "2026-09-14T21:18:48+00:00"
}
