{
  "id": "imagine-town",
  "title": "Imagine Town Magazine / Game Candy",
  "metadata_status": "stub",
  "publishers": [],
  "country": "US",
  "language": "en",
  "first_issue": {
    "date": "2008"
  },
  "last_issue": {
    "date": "2009"
  },
  "status": "ceased",
  "categories": {
    "type": "consumer",
    "platforms": [
      "other"
    ]
  },
  "numbering": {
    "scheme": "sequential",
    "notes": "unverified"
  },
  "default_provider": "vghf",
  "rights": {
    "status": "link-only",
    "note": "Inherited from default provider; review before hosting."
  },
  "known_sources": [
    {
      "provider": "vghf",
      "url": "https://archive.gamehistory.org/folder/6187132e-315c-4be5-8498-8c55ac478ebe",
      "date_range": "Summer 2009 – undated, distributed December/January 2009",
      "items": 3
    }
  ],
  "stats": {
    "issues": 3,
    "pages": 60,
    "readable": 3,
    "with_text": 3,
    "first_year": 2009,
    "last_year": 2009
  },
  "updated_at": "2026-09-17T06:56:38+00:00"
}
