{
  "id": "gamesport",
  "title": "GameSport",
  "metadata_status": "stub",
  "publishers": [],
  "country": "US",
  "language": "en",
  "first_issue": {
    "date": "1995"
  },
  "last_issue": {
    "date": "1995"
  },
  "status": "ceased",
  "categories": {
    "type": "consumer",
    "platforms": [
      "multi"
    ]
  },
  "numbering": {
    "scheme": "sequential",
    "notes": "unverified"
  },
  "default_provider": "vghf",
  "rights": {
    "status": "link-only",
    "note": "Inherited from default provider; review before hosting."
  },
  "known_sources": [
    {
      "provider": "vghf",
      "url": "https://archive.gamehistory.org/folder/a238608c-2fe1-481a-ac89-e519abd73151",
      "date_range": "1995 – 1995",
      "items": 2
    }
  ],
  "stats": {
    "issues": 2,
    "pages": 216,
    "readable": 2,
    "with_text": 2,
    "first_year": 1995,
    "last_year": 1995
  },
  "updated_at": "2026-09-17T06:56:38+00:00"
}
