{
  "id": "gamepro",
  "title": "GamePro",
  "metadata_status": "stub",
  "publishers": [
    {
      "name": "IDG"
    }
  ],
  "country": "US",
  "language": "en",
  "first_issue": {
    "date": "1989-05"
  },
  "last_issue": {
    "date": "2011-12"
  },
  "status": "ceased",
  "categories": {
    "type": "consumer",
    "platforms": [
      "multi"
    ]
  },
  "numbering": {
    "scheme": "sequential",
    "notes": "unverified"
  },
  "default_provider": "internet-archive",
  "rights": {
    "status": "community-scan",
    "note": "Inherited from default provider; review before hosting."
  },
  "known_sources": [
    {
      "provider": "internet-archive",
      "url": "https://archive.org/details/gamepromagazine",
      "items": 474,
      "date_range": "1989–2026"
    },
    {
      "provider": "vghf",
      "url": "https://archive.gamehistory.org/folder/baf6da18-d798-448f-994d-af23f7f4ffad",
      "items": 269,
      "date_range": "May 1989–Winter 2011"
    }
  ],
  "stats": {
    "issues": 268,
    "pages": 39092,
    "readable": 268,
    "with_text": 248,
    "first_year": 1989,
    "last_year": 2011
  },
  "updated_at": "2026-09-15T21:03:50+00:00",
  "cover_issue": "gamepro-1"
}
